{
  "checkpoint_id": "RELEASE_A_A2_BOUNDED_FRAME_CHECKPOINT_v1.0",
  "checkpoint_sha256": "452c8c504990c05edd6ac7c29b542a49ffa4fd81ccdece2bd7ca8e9e0921ca32",
  "status": "FROZEN_v1.0",
  "assembled_on": "2026-09-26",
  "analysis_universe_id": "RAU-feb22ac8e7bc2f9ee644ecc2682e974eb73a40bfc5dccfc2ce2f3ee37abd774e",
  "world_time_cutoff": "2026-09-24",
  "knowledge_time_cutoff": "2026-10-24T23:59:59Z",
  "claim_scope": "BOUNDED_FRAME_EXHAUSTION_UNDER_FROZEN_PROTOCOLS",
  "round_start_known_identity_ids": [
    "PRD-EMOTIV-EPOC-X",
    "PRD-FLOW-FL-100",
    "PRD-MODIUS-SPERO",
    "PRD-MUSE-S-ATHENA",
    "PRD-NEXTSENSE-SMARTBUDS",
    "PRD-SYNCHRON-STENTRODE"
  ],
  "round_start_known_identity_set_sha256": "21034ecec898f81f27ad143282967354315b5b31f9eaf430334ca172186c26c0",
  "final_known_identity_ids": [
    "PRD-EMOTIV-EPOC-X",
    "PRD-FLOW-FL-100",
    "PRD-MODIUS-SPERO",
    "PRD-MUSE-S-ATHENA",
    "PRD-NEXTSENSE-SMARTBUDS",
    "PRD-SYNCHRON-STENTRODE"
  ],
  "final_known_identity_set_sha256": "21034ecec898f81f27ad143282967354315b5b31f9eaf430334ca172186c26c0",
  "canonical_offering_ids": [
    "PRD-EMOTIV-EPOC-X",
    "PRD-FLOW-FL-100",
    "PRD-MODIUS-SPERO",
    "PRD-MUSE-S-ATHENA",
    "PRD-NEXTSENSE-SMARTBUDS",
    "PRD-SYNCHRON-STENTRODE"
  ],
  "canonical_offering_set_sha256": "21034ecec898f81f27ad143282967354315b5b31f9eaf430334ca172186c26c0",
  "canonical_offering_binding": {
    "a1_identity_registry_id": "RELEASE_A_PRODUCT_IDENTITY_REGISTRY_v1.0",
    "a1_identity_registry_sha256": "65023d77ca9187ef068a40366c919e858149054764d06a7146e2282768e0fadc",
    "new_canonical_allocations_during_bounded_frames": 0,
    "note": "Canonical offering IDs remain exactly the A1 identity-registry allocations. Bounded-frame execution produced zero new PRODUCT/OFFERING allocations."
  },
  "frame_terminal_bindings": {
    "F2": {
      "frame_id": "F2",
      "stop_state": "BOUNDED_FRAME_EXHAUSTED",
      "barrier_state": null,
      "source_exhaustion_state": "PROVIDER_QUERY_UNIVERSE_EXHAUSTED",
      "final_run_id": "PDR-5585af25b1594c7ad52d2c0a9521570f919f243219eb075b9c3abecfd306bd3d",
      "final_packet_id": "RELEASE_A_A2_F2_EXHAUSTION_F3_FORMAL_RETRY_TRANCHE_2_v1.0",
      "final_packet_sha256": "d66590970362ac82b880e5fe4b9d7c66a913b6dc91618d31fbf67fa39a31c39b",
      "provider_query_universe_id": "RELEASE_A_F2_PROVIDER_QUERY_UNIVERSE_v1.0",
      "provider_query_universe_sha256": "7100742182020a7afb91fee5b9c175211eed4d10adac7c2f40bf52ee705af7b0"
    },
    "F3": {
      "frame_id": "F3",
      "stop_state": "BOUNDED_FRAME_EXHAUSTED",
      "barrier_state": null,
      "source_exhaustion_state": "PROVIDER_QUERY_UNIVERSE_EXHAUSTED",
      "final_run_id": "PDR-e4d613d91fce2cfc70cd4792d7b28c4ac4c316a0850dcbc04d9474828677af05",
      "final_packet_id": "RELEASE_A_A2_F3_INTERVENTION_DEVICE_EXHAUSTION_TRANCHE_3_v1.0",
      "final_packet_sha256": "584ab1dae1fcf0885a51ec527bea953a2ee4ad5452c10b7bb6985ca652edb82b",
      "provider_query_universe_id": "RELEASE_A_F3_PROVIDER_QUERY_UNIVERSE_v1.0",
      "provider_query_universe_sha256": "7baeb3c7549286360fa6bd5494bcc3386d50e42b34f6be7c487adb9bdbfe10e2"
    },
    "F9": {
      "frame_id": "F9",
      "stop_state": "BOUNDED_FRAME_EXHAUSTED",
      "barrier_state": null,
      "source_exhaustion_state": "ACTOR_SEED_SET_EXHAUSTED",
      "final_completion_ledger_id": "RELEASE_A_F9_ACTOR_COMPLETION_LEDGER_008_v1.0",
      "final_completion_ledger_sha256": "8ed73ad8e53c341f28a749527e5cc6e7277b5a37ba205231ed8219d24c27fc9e",
      "procedure_id": "RELEASE_A_F9_ACTOR_ENUMERATION_PROCEDURE_v1.0",
      "procedure_sha256": "402af2464750688b6f7cb36f3444c113871836d4dd4fe9feac17350431710e72",
      "final_source_packet_id": "RELEASE_A_A2_F9_REMAINING_ACTORS_PROTOCOL_TRANCHE_12_v1.0",
      "final_source_packet_sha256": "ec36291d58685e30e19903a04ec83b9ba03a8cf3931f311881438eea4b3c8407"
    }
  },
  "unresolved_candidates": [
    {
      "frame_id": "F3",
      "candidate_key": "NCT00746525",
      "capture_id": "PDC-1a1048c6cf6b559acbe4f9bbaca7461ebfd00894afc55d33fce7eb78e89b8162",
      "source_packet_id": "RELEASE_A_A2_F3_INTERVENTION_DEVICE_EXHAUSTION_TRANCHE_3_v1.0",
      "source_packet_sha256": "584ab1dae1fcf0885a51ec527bea953a2ee4ad5452c10b7bb6985ca652edb82b"
    },
    {
      "frame_id": "F3",
      "candidate_key": "NCT00802490",
      "capture_id": "PDC-01f05cd544f5119556c79fd4b42e6a55b13d25dd1ec99f4d61bb52075d08f56a",
      "source_packet_id": "RELEASE_A_A2_F3_INTERVENTION_DEVICE_EXHAUSTION_TRANCHE_3_v1.0",
      "source_packet_sha256": "584ab1dae1fcf0885a51ec527bea953a2ee4ad5452c10b7bb6985ca652edb82b"
    },
    {
      "frame_id": "F3",
      "candidate_key": "NCT00860951",
      "capture_id": "PDC-ac48ffb65081772e209a3e27fa4411bc4ec518c27084c96a8c721db86d7e8f71",
      "source_packet_id": "RELEASE_A_A2_F3_INTERVENTION_DEVICE_EXHAUSTION_TRANCHE_3_v1.0",
      "source_packet_sha256": "584ab1dae1fcf0885a51ec527bea953a2ee4ad5452c10b7bb6985ca652edb82b"
    },
    {
      "frame_id": "F3",
      "candidate_key": "NCT00886483",
      "capture_id": "PDC-b2ce1ab68d62b6acc4711d2ee6653abe4e5c2ac28f4e1a9bbf8dd95f1ce37fc8",
      "source_packet_id": "RELEASE_A_A2_F3_INTERVENTION_DEVICE_EXHAUSTION_TRANCHE_3_v1.0",
      "source_packet_sha256": "584ab1dae1fcf0885a51ec527bea953a2ee4ad5452c10b7bb6985ca652edb82b"
    },
    {
      "frame_id": "F3",
      "candidate_key": "NCT00912041",
      "capture_id": "PDC-b4801f984d4892b49ed3674249b8c490dd08795bbe058d7588bc5eb297a6495c",
      "source_packet_id": "RELEASE_A_A2_F3_INTERVENTION_DEVICE_EXHAUSTION_TRANCHE_3_v1.0",
      "source_packet_sha256": "584ab1dae1fcf0885a51ec527bea953a2ee4ad5452c10b7bb6985ca652edb82b"
    },
    {
      "frame_id": "F3",
      "candidate_key": "NCT00955838",
      "capture_id": "PDC-b20217349529822e4727ed1566579efe92f1d4ca6c0ce6bd0963f1746bcdd028",
      "source_packet_id": "RELEASE_A_A2_F3_INTERVENTION_DEVICE_EXHAUSTION_TRANCHE_3_v1.0",
      "source_packet_sha256": "584ab1dae1fcf0885a51ec527bea953a2ee4ad5452c10b7bb6985ca652edb82b"
    },
    {
      "frame_id": "F3",
      "candidate_key": "NCT01117727",
      "capture_id": "PDC-c4c5f8379cd916fc763bbcf4450a42e7d81384f3c8e9187320dfc3a9bba57c1b",
      "source_packet_id": "RELEASE_A_A2_F3_INTERVENTION_DEVICE_EXHAUSTION_TRANCHE_3_v1.0",
      "source_packet_sha256": "584ab1dae1fcf0885a51ec527bea953a2ee4ad5452c10b7bb6985ca652edb82b"
    },
    {
      "frame_id": "F3",
      "candidate_key": "NCT01119001",
      "capture_id": "PDC-5a21e4f7841a93b80c139c60a6402232ed04351b60018b143ecbbfaa9cc56806",
      "source_packet_id": "RELEASE_A_A2_F3_INTERVENTION_DEVICE_EXHAUSTION_TRANCHE_3_v1.0",
      "source_packet_sha256": "584ab1dae1fcf0885a51ec527bea953a2ee4ad5452c10b7bb6985ca652edb82b"
    },
    {
      "frame_id": "F3",
      "candidate_key": "NCT01123148",
      "capture_id": "PDC-943714f3da2e629bcdb2a76a6c11f33d28fb813cf770c6b378bb646659c63912",
      "source_packet_id": "RELEASE_A_A2_F3_INTERVENTION_DEVICE_EXHAUSTION_TRANCHE_3_v1.0",
      "source_packet_sha256": "584ab1dae1fcf0885a51ec527bea953a2ee4ad5452c10b7bb6985ca652edb82b"
    },
    {
      "frame_id": "F3",
      "candidate_key": "NCT01123200",
      "capture_id": "PDC-86e984e3cfdc170f73e6f252dbf8e6acdf402475f351a1b6f0a6263af3746346",
      "source_packet_id": "RELEASE_A_A2_F3_INTERVENTION_DEVICE_EXHAUSTION_TRANCHE_3_v1.0",
      "source_packet_sha256": "584ab1dae1fcf0885a51ec527bea953a2ee4ad5452c10b7bb6985ca652edb82b"
    },
    {
      "frame_id": "F3",
      "candidate_key": "NCT01287975",
      "capture_id": "PDC-9ca57fb2b1a29875f6ee00566374214f90662d6c2b79069351d61c048ba20632",
      "source_packet_id": "RELEASE_A_A2_F3_INTERVENTION_DEVICE_EXHAUSTION_TRANCHE_3_v1.0",
      "source_packet_sha256": "584ab1dae1fcf0885a51ec527bea953a2ee4ad5452c10b7bb6985ca652edb82b"
    },
    {
      "frame_id": "F3",
      "candidate_key": "NCT01344044",
      "capture_id": "PDC-54c4282e0437b9f025d08602af6a3228164ba935f249f3cd5c6c8919fbf07078",
      "source_packet_id": "RELEASE_A_A2_F3_INTERVENTION_DEVICE_EXHAUSTION_TRANCHE_3_v1.0",
      "source_packet_sha256": "584ab1dae1fcf0885a51ec527bea953a2ee4ad5452c10b7bb6985ca652edb82b"
    },
    {
      "frame_id": "F3",
      "candidate_key": "NCT01364480",
      "capture_id": "PDC-8f140f42dd6665ad4af13e0196a424d7e75c3cb70ea276f654df5552694cbb08",
      "source_packet_id": "RELEASE_A_A2_F3_INTERVENTION_DEVICE_EXHAUSTION_TRANCHE_3_v1.0",
      "source_packet_sha256": "584ab1dae1fcf0885a51ec527bea953a2ee4ad5452c10b7bb6985ca652edb82b"
    },
    {
      "frame_id": "F3",
      "candidate_key": "NCT01393444",
      "capture_id": "PDC-5244967da4f9925e7b2f76c2775aac05ad78bc14a0448f507fdfa824ae4827a1",
      "source_packet_id": "RELEASE_A_A2_F3_INTERVENTION_DEVICE_EXHAUSTION_TRANCHE_3_v1.0",
      "source_packet_sha256": "584ab1dae1fcf0885a51ec527bea953a2ee4ad5452c10b7bb6985ca652edb82b"
    },
    {
      "frame_id": "F3",
      "candidate_key": "NCT01518426",
      "capture_id": "PDC-2ac8f4af403dfc992b6f8d6089dccce225ef4119d37ac6d53e5947fd0a2320e4",
      "source_packet_id": "RELEASE_A_A2_F3_INTERVENTION_DEVICE_EXHAUSTION_TRANCHE_3_v1.0",
      "source_packet_sha256": "584ab1dae1fcf0885a51ec527bea953a2ee4ad5452c10b7bb6985ca652edb82b"
    },
    {
      "frame_id": "F3",
      "candidate_key": "NCT01560039",
      "capture_id": "PDC-92715e7ed2d50c9a5cbd4cdea62d363e9b75544905e7883a9d33d8f118019ec5",
      "source_packet_id": "RELEASE_A_A2_F3_INTERVENTION_DEVICE_EXHAUSTION_TRANCHE_3_v1.0",
      "source_packet_sha256": "584ab1dae1fcf0885a51ec527bea953a2ee4ad5452c10b7bb6985ca652edb82b"
    },
    {
      "frame_id": "F3",
      "candidate_key": "NCT01591408",
      "capture_id": "PDC-eccbe42d1af61a5719d7fa6fdba45ca0eaf58f990b1db3919ab00737dd5c5d97",
      "source_packet_id": "RELEASE_A_A2_F3_INTERVENTION_DEVICE_EXHAUSTION_TRANCHE_3_v1.0",
      "source_packet_sha256": "584ab1dae1fcf0885a51ec527bea953a2ee4ad5452c10b7bb6985ca652edb82b"
    },
    {
      "frame_id": "F3",